[
  {
    "id": "starfish",
    "title": "Starfish",
    "category": "animal",
    "clue": "No, this is Patrick!",
    "dots": [
      {"id": "t0", "x": 0.521, "y": 0.258, "degree": 2},
      {"id": "v0", "x": 0.644, "y": 0.489, "degree": 4},
      {"id": "t1", "x": 0.92, "y": 0.593, "degree": 2},
      {"id": "v1", "x": 0.739, "y": 0.781, "degree": 4},
      {"id": "t2", "x": 0.725, "y": 1.076, "degree": 2},
      {"id": "v2", "x": 0.491, "y": 0.961, "degree": 4},
      {"id": "t3", "x": 0.206, "y": 1.039, "degree": 2},
      {"id": "v3", "x": 0.242, "y": 0.781, "degree": 4},
      {"id": "t4", "x": 0.08, "y": 0.534, "degree": 2},
      {"id": "v4", "x": 0.337, "y": 0.489, "degree": 4},
      {"id": "e1", "x": 0.427, "y": 0.573, "degree": 1},
      {"id": "e2", "x": 0.427, "y": 0.692, "degree": 1},
      {"id": "e3", "x": 0.554, "y": 0.573, "degree": 1},
      {"id": "e4", "x": 0.554, "y": 0.692, "degree": 1},
      {"id": "m1", "x": 0.38, "y": 0.803, "degree": 1},
      {"id": "m2", "x": 0.491, "y": 0.842, "degree": 2},
      {"id": "m3", "x": 0.601, "y": 0.803, "degree": 1}
    ],
    "edges": [["e1", "e2"], ["e3", "e4"], ["m1", "m2"], ["m2", "m3"], ["t0", "v0"], ["v0", "t1"], ["t1", "v1"], ["v1", "t2"], ["t2", "v2"], ["v2", "t3"], ["t3", "v3"], ["v3", "t4"], ["t4", "v4"], ["v4", "t0"], ["v0", "v1"], ["v1", "v2"], ["v2", "v3"], ["v3", "v4"], ["v4", "v0"]],
    "colors": {"e1|e2": "white", "e3|e4": "white", "m1|m2": "red", "m2|m3": "red", "t0|v0": "pink", "t1|v0": "pink", "t1|v1": "pink", "t2|v1": "pink", "t2|v2": "pink", "t3|v2": "pink", "t3|v3": "pink", "t4|v3": "pink", "t4|v4": "pink", "t0|v4": "pink", "v0|v1": "red", "v1|v2": "red", "v2|v3": "red", "v3|v4": "red", "v0|v4": "red"}
  },
  {
    "id": "barn",
    "title": "Barn",
    "category": "object",
    "clue": "Old MacDonald's headquarters",
    "dots": [
      {"id": "pk", "x": 0.5, "y": 0.227, "degree": 3},
      {"id": "rbL", "x": 0.19, "y": 0.439, "degree": 2},
      {"id": "evL", "x": 0.093, "y": 0.65, "degree": 3},
      {"id": "bsL", "x": 0.093, "y": 1.253, "degree": 2},
      {"id": "dtL", "x": 0.288, "y": 0.813, "degree": 3},
      {"id": "dbL", "x": 0.288, "y": 1.253, "degree": 4},
      {"id": "dtm", "x": 0.5, "y": 0.813, "degree": 5},
      {"id": "dbm", "x": 0.5, "y": 1.253, "degree": 5},
      {"id": "wtL", "x": 0.402, "y": 0.406, "degree": 3},
      {"id": "wbL", "x": 0.402, "y": 0.569, "degree": 3},
      {"id": "wv", "x": 0.5, "y": 0.08, "degree": 1},
      {"id": "rbR", "x": 0.81, "y": 0.439, "degree": 2},
      {"id": "evR", "x": 0.907, "y": 0.65, "degree": 3},
      {"id": "bsR", "x": 0.907, "y": 1.253, "degree": 2},
      {"id": "dtR", "x": 0.712, "y": 0.813, "degree": 3},
      {"id": "dbR", "x": 0.712, "y": 1.253, "degree": 4},
      {"id": "wtR", "x": 0.598, "y": 0.406, "degree": 3},
      {"id": "wbR", "x": 0.598, "y": 0.569, "degree": 3}
    ],
    "edges": [["pk", "rbL"], ["rbL", "evL"], ["evL", "bsL"], ["bsL", "dbL"], ["dbL", "dbm"], ["dbm", "dbR"], ["dbR", "bsR"], ["bsR", "evR"], ["evR", "rbR"], ["rbR", "pk"], ["pk", "wv"], ["evL", "evR"], ["dtL", "dtm"], ["dtm", "dtR"], ["dtR", "dbR"], ["dbR", "dtm"], ["dtm", "dbm"], ["dbm", "dtL"], ["dtL", "dbL"], ["dbL", "dtm"], ["dbm", "dtR"], ["wtL", "wtR"], ["wtR", "wbR"], ["wbR", "wbL"], ["wbL", "wtL"], ["wtL", "wbR"], ["wbL", "wtR"]],
    "colors": {"pk|rbL": "red", "evL|rbL": "red", "bsL|evL": "red", "bsL|dbL": "red", "dbL|dbm": "white", "dbR|dbm": "white", "bsR|dbR": "red", "bsR|evR": "red", "evR|rbR": "red", "pk|rbR": "red", "evL|evR": "white", "dtL|dtm": "white", "dtR|dtm": "white", "dbR|dtR": "white", "dbR|dtm": "white", "dbm|dtm": "white", "dbm|dtL": "white", "dbL|dtL": "white", "dbL|dtm": "white", "dbm|dtR": "white", "wtL|wtR": "white", "wbR|wtR": "white", "wbL|wbR": "white", "wbL|wtL": "white", "wbR|wtL": "white", "wbL|wtR": "white"}
  },
  {
    "id": "drum",
    "title": "Drum",
    "category": "object",
    "clue": "Ba-dum-tss!",
    "dots": [
      {"id": "h0", "x": 0.92, "y": 0.662, "degree": 4},
      {"id": "h1", "x": 0.797, "y": 0.759, "degree": 4},
      {"id": "h2", "x": 0.5, "y": 0.799, "degree": 4},
      {"id": "h3", "x": 0.203, "y": 0.759, "degree": 4},
      {"id": "h4", "x": 0.08, "y": 0.662, "degree": 4},
      {"id": "h5", "x": 0.203, "y": 0.565, "degree": 2},
      {"id": "h6", "x": 0.5, "y": 0.525, "degree": 2},
      {"id": "h7", "x": 0.797, "y": 0.565, "degree": 2},
      {"id": "b0", "x": 0.92, "y": 1.064, "degree": 3},
      {"id": "b1", "x": 0.797, "y": 1.161, "degree": 4},
      {"id": "b2", "x": 0.5, "y": 1.201, "degree": 4},
      {"id": "b3", "x": 0.203, "y": 1.161, "degree": 4},
      {"id": "b4", "x": 0.08, "y": 1.064, "degree": 3},
      {"id": "s1a", "x": 0.208, "y": 0.133, "degree": 1},
      {"id": "s1b", "x": 0.792, "y": 0.443, "degree": 1},
      {"id": "s2a", "x": 0.792, "y": 0.133, "degree": 1},
      {"id": "s2b", "x": 0.208, "y": 0.443, "degree": 1},
      {"id": "sx", "x": 0.5, "y": 0.288, "degree": 4}
    ],
    "edges": [["b0", "h0"], ["h0", "h1"], ["h1", "h2"], ["h2", "h3"], ["h3", "h4"], ["h4", "h5"], ["h5", "h6"], ["h6", "h7"], ["h7", "h0"], ["h0", "b1"], ["b1", "b0"], ["b0", "h1"], ["h1", "b2"], ["b2", "b1"], ["b1", "h2"], ["h2", "b3"], ["b3", "b2"], ["b2", "h3"], ["h3", "b4"], ["b4", "b3"], ["b3", "h4"], ["h4", "b4"], ["s1a", "sx"], ["sx", "s1b"], ["s2a", "sx"], ["sx", "s2b"]],
    "colors": {"b0|h0": "red", "h0|h1": "white", "h1|h2": "white", "h2|h3": "white", "h3|h4": "white", "h4|h5": "white", "h5|h6": "white", "h6|h7": "white", "h0|h7": "white", "b0|b1": "red", "b1|b2": "red", "b2|b3": "red", "b3|b4": "red", "b4|h4": "red", "s1a|sx": "brown", "s1b|sx": "brown", "s2a|sx": "brown", "s2b|sx": "brown"}
  },
  {
    "id": "pine",
    "title": "Pine tree",
    "category": "plant",
    "clue": "Evergreen and never needs a haircut",
    "dots": [
      {"id": "ap", "x": 0.5, "y": 0.087, "degree": 3},
      {"id": "o1L", "x": 0.265, "y": 0.406, "degree": 2},
      {"id": "o1R", "x": 0.735, "y": 0.406, "degree": 2},
      {"id": "i1L", "x": 0.382, "y": 0.406, "degree": 3},
      {"id": "i1R", "x": 0.618, "y": 0.406, "degree": 3},
      {"id": "c1", "x": 0.5, "y": 0.406, "degree": 4},
      {"id": "o2L", "x": 0.164, "y": 0.725, "degree": 2},
      {"id": "o2R", "x": 0.836, "y": 0.725, "degree": 2},
      {"id": "i2L", "x": 0.315, "y": 0.725, "degree": 3},
      {"id": "i2R", "x": 0.685, "y": 0.725, "degree": 3},
      {"id": "c2", "x": 0.5, "y": 0.725, "degree": 4},
      {"id": "o3L", "x": 0.08, "y": 1.061, "degree": 2},
      {"id": "o3R", "x": 0.92, "y": 1.061, "degree": 2},
      {"id": "tkL", "x": 0.382, "y": 1.061, "degree": 3},
      {"id": "tkR", "x": 0.618, "y": 1.061, "degree": 3},
      {"id": "c3", "x": 0.5, "y": 1.061, "degree": 3},
      {"id": "tbL", "x": 0.382, "y": 1.246, "degree": 2},
      {"id": "tbR", "x": 0.618, "y": 1.246, "degree": 2}
    ],
    "edges": [["ap", "o1L"], ["o1L", "i1L"], ["i1L", "c1"], ["c1", "i1R"], ["i1R", "o1R"], ["o1R", "ap"], ["ap", "c1"], ["c1", "c2"], ["c2", "c3"], ["c3", "tkL"], ["tkL", "o3L"], ["o3L", "i2L"], ["i2L", "o2L"], ["o2L", "i1L"], ["i1R", "o2R"], ["o2R", "i2R"], ["i2R", "c2"], ["c2", "i2L"], ["i2R", "o3R"], ["o3R", "tkR"], ["tkR", "c3"], ["tkL", "tbL"], ["tbL", "tbR"], ["tbR", "tkR"]],
    "colors": {"ap|o1L": "green", "i1L|o1L": "green", "c1|i1L": "green", "c1|i1R": "green", "i1R|o1R": "green", "ap|o1R": "green", "ap|c1": "brown", "c1|c2": "brown", "c2|c3": "brown", "c3|tkL": "green", "o3L|tkL": "green", "i2L|o3L": "green", "i2L|o2L": "green", "i1L|o2L": "green", "i1R|o2R": "green", "i2R|o2R": "green", "c2|i2R": "green", "c2|i2L": "green", "i2R|o3R": "green", "o3R|tkR": "green", "c3|tkR": "green", "tbL|tkL": "brown", "tbL|tbR": "brown", "tbR|tkR": "brown"}
  },
  {
    "id": "teapot",
    "title": "Teapot",
    "category": "object",
    "clue": "Short and stout",
    "dots": [
      {"id": "kn", "x": 0.515, "y": 0.329, "degree": 2},
      {"id": "dl", "x": 0.425, "y": 0.427, "degree": 3},
      {"id": "dr", "x": 0.605, "y": 0.427, "degree": 3},
      {"id": "rl", "x": 0.365, "y": 0.524, "degree": 3},
      {"id": "rr", "x": 0.665, "y": 0.524, "degree": 3},
      {"id": "sl", "x": 0.275, "y": 0.629, "degree": 3},
      {"id": "sr", "x": 0.755, "y": 0.629, "degree": 3},
      {"id": "wl", "x": 0.245, "y": 0.779, "degree": 4},
      {"id": "wr", "x": 0.785, "y": 0.779, "degree": 3},
      {"id": "bl", "x": 0.29, "y": 0.914, "degree": 2},
      {"id": "br", "x": 0.74, "y": 0.914, "degree": 3},
      {"id": "fl", "x": 0.365, "y": 1.004, "degree": 2},
      {"id": "fr", "x": 0.665, "y": 1.004, "degree": 2},
      {"id": "st", "x": 0.08, "y": 0.464, "degree": 2},
      {"id": "sd", "x": 0.14, "y": 0.689, "degree": 2},
      {"id": "h1", "x": 0.875, "y": 0.614, "degree": 2},
      {"id": "h2", "x": 0.92, "y": 0.749, "degree": 2},
      {"id": "h3", "x": 0.86, "y": 0.869, "degree": 2}
    ],
    "edges": [["dl", "rl"], ["rl", "rr"], ["rr", "dr"], ["dr", "kn"], ["kn", "dl"], ["dl", "dr"], ["rl", "sl"], ["sl", "wl"], ["wl", "bl"], ["bl", "fl"], ["fl", "fr"], ["fr", "br"], ["br", "wr"], ["wr", "sr"], ["sr", "rr"], ["sl", "st"], ["st", "sd"], ["sd", "wl"], ["wl", "wr"], ["sr", "h1"], ["h1", "h2"], ["h2", "h3"], ["h3", "br"]],
    "colors": {"dl|rl": "white", "rl|rr": "white", "dr|rr": "white", "dr|kn": "white", "dl|kn": "white", "dl|dr": "white", "rl|sl": "blue", "sl|wl": "blue", "bl|wl": "blue", "bl|fl": "blue", "fl|fr": "blue", "br|fr": "blue", "br|wr": "blue", "sr|wr": "blue", "rr|sr": "blue", "sl|st": "blue", "sd|st": "blue", "sd|wl": "blue", "wl|wr": "pink", "h1|sr": "blue", "h1|h2": "blue", "h2|h3": "blue", "br|h3": "blue"}
  },
  {
    "id": "sled",
    "title": "Sled",
    "category": "object",
    "clue": "Rosebud...",
    "dots": [
      {"id": "p0", "x": 0.123, "y": 0.743, "degree": 2},
      {"id": "p3", "x": 0.703, "y": 0.743, "degree": 3},
      {"id": "q3", "x": 0.703, "y": 0.873, "degree": 2},
      {"id": "q0", "x": 0.123, "y": 0.873, "degree": 2},